{
  "schema": "eravos.tool/1",
  "id": "eravos.wub-sub",
  "version": "1.0.0",
  "label": "Wub Sub",
  "icon": "◉",
  "accent": "#7c4dff",
  "domain": "music",
  "category": "wubs",
  "summary": "The clean low end under the wobble — follows your Wub Osc notes, never wobbles, glides with it.",
  "tags": [
    "wubs",
    "sub",
    "bass",
    "808",
    "dubstep"
  ],
  "files": {
    "engine": "wub-sub.engine.js",
    "ui": "wub-sub.ui.js",
    "preview": "preview.png",
    "spec": "wub-sub.spec",
    "tests": "wub-sub.test.js"
  },
  "needs": {
    "units": [
      "music.engine"
    ],
    "tools": [],
    "permissions": [
      "audio_out",
      "midi_in",
      "bus_publish",
      "bus_subscribe",
      "registry_read"
    ]
  },
  "packs": {
    "accepts": [
      "presets"
    ],
    "shipped": [
      "factory"
    ]
  },
  "works_with": [
    "eravos.acid-synth",
    "eravos.bass-drop-builder",
    "eravos.bass-forge",
    "eravos.breath",
    "eravos.channel",
    "eravos.clip-maker",
    "eravos.contrast-analyser",
    "eravos.coven",
    "eravos.curve-synth",
    "eravos.drum-forge",
    "eravos.dub-station",
    "eravos.edm-lab",
    "eravos.embodiment-lab",
    "eravos.fx-box",
    "eravos.fx-destroyer",
    "eravos.fx-dynamics",
    "eravos.fx-echo",
    "eravos.fx-eq",
    "eravos.fx-filter",
    "eravos.fx-glitch",
    "eravos.fx-haunt",
    "eravos.fx-moddelay",
    "eravos.fx-phaser",
    "eravos.fx-pitch",
    "eravos.harmonic-analyzer",
    "eravos.lfo",
    "eravos.macro-automation",
    "eravos.master-fx",
    "eravos.organ",
    "eravos.pad-forge",
    "eravos.pads",
    "eravos.ratio-lattice",
    "eravos.recursive-spectra",
    "eravos.reese-bass",
    "eravos.retro-poly",
    "eravos.sample-player",
    "eravos.sidechain-compressor",
    "eravos.song-recorder",
    "eravos.sub-engine",
    "eravos.supersaw",
    "eravos.syn-env",
    "eravos.syn-osc",
    "eravos.syn-partials",
    "eravos.timeline",
    "eravos.wobble-bass",
    "eravos.wub-filter",
    "eravos.wub-osc",
    "eravos.wub-rate",
    "eravos.xen-synth",
    "eravos.xy-pad"
  ],
  "conflicts": [],
  "status": "built"
}
