{
  "schema": "eravos.tool/1",
  "id": "eravos.wub-rate",
  "version": "1.0.0",
  "label": "Wub Rate",
  "icon": "〽",
  "accent": "#b066ff",
  "domain": "music",
  "category": "wubs",
  "summary": "The wobble’s rhythm: a step pattern of rates (1/8, 1/16, triplets, off) — wire its violet dot to Wub Filter.",
  "tags": [
    "wubs",
    "wobble",
    "lfo",
    "rhythm",
    "modulation",
    "polarity",
    "dubstep"
  ],
  "files": {
    "engine": "wub-rate.engine.js",
    "ui": "wub-rate.ui.js",
    "preview": "preview.png",
    "spec": "wub-rate.spec",
    "tests": "wub-rate.test.js"
  },
  "needs": {
    "units": [
      "music.engine"
    ],
    "tools": [],
    "permissions": [
      "audio_out",
      "bus_publish",
      "bus_subscribe",
      "registry_read"
    ]
  },
  "packs": {
    "accepts": [
      "presets"
    ],
    "shipped": [
      "factory"
    ]
  },
  "works_with": [
    "eravos.acid-synth",
    "eravos.bass-forge",
    "eravos.breath",
    "eravos.channel",
    "eravos.coven",
    "eravos.dub-station",
    "eravos.edm-lab",
    "eravos.embodiment-lab",
    "eravos.fx-destroyer",
    "eravos.fx-dynamics",
    "eravos.fx-echo",
    "eravos.fx-eq",
    "eravos.fx-filter",
    "eravos.fx-glitch",
    "eravos.fx-haunt",
    "eravos.fx-moddelay",
    "eravos.fx-phaser",
    "eravos.fx-pitch",
    "eravos.granular",
    "eravos.lfo",
    "eravos.macro-automation",
    "eravos.master-fx",
    "eravos.organ",
    "eravos.pad-forge",
    "eravos.pads",
    "eravos.recursive-spectra",
    "eravos.reese-bass",
    "eravos.retro-poly",
    "eravos.sample-player",
    "eravos.sidechain-compressor",
    "eravos.sub-engine",
    "eravos.suite",
    "eravos.supersaw",
    "eravos.syn-env",
    "eravos.syn-osc",
    "eravos.syn-partials",
    "eravos.wobble-bass",
    "eravos.wub-filter",
    "eravos.wub-osc",
    "eravos.wub-sub",
    "eravos.xen-synth",
    "eravos.xy-pad"
  ],
  "conflicts": [],
  "status": "built"
}
