{
  "schema": "eravos.tool/1",
  "id": "eravos.edm-lab",
  "version": "3.0.0",
  "label": "EDM Lab",
  "icon": "⚗",
  "accent": "#ff2266",
  "domain": "music",
  "category": "generators",
  "summary": "Paint where the rhythm is busy, turn TENSION: drums, bass and chords follow — always in key.",
  "tags": [
    "generators",
    "edm",
    "lab"
  ],
  "files": {
    "engine": "edm-lab.engine.js",
    "ui": "edm-lab.ui.js",
    "spec": "edm-lab.spec",
    "preview": "preview.png",
    "tests": "edm-lab.test.js"
  },
  "needs": {
    "units": [
      "music.engine"
    ],
    "tools": [],
    "permissions": [
      "audio_out",
      "bus_publish",
      "bus_subscribe",
      "registry_read"
    ]
  },
  "packs": {
    "accepts": [
      "presets"
    ],
    "shipped": [
      "factory"
    ]
  },
  "works_with": [
    "eravos.breath",
    "eravos.channel",
    "eravos.clip-maker",
    "eravos.contrast-analyser",
    "eravos.dub-station",
    "eravos.embodiment-lab",
    "eravos.fx-destroyer",
    "eravos.fx-dynamics",
    "eravos.fx-echo",
    "eravos.fx-eq",
    "eravos.fx-filter",
    "eravos.fx-glitch",
    "eravos.fx-haunt",
    "eravos.fx-moddelay",
    "eravos.fx-phaser",
    "eravos.fx-pitch",
    "eravos.granular",
    "eravos.harmonic-analyzer",
    "eravos.lfo",
    "eravos.macro-automation",
    "eravos.master-fx",
    "eravos.sidechain-compressor",
    "eravos.syn-env",
    "eravos.syn-osc",
    "eravos.wub-filter",
    "eravos.wub-osc",
    "eravos.wub-rate",
    "eravos.wub-sub",
    "eravos.xy-pad"
  ],
  "status": "built",
  "conflicts": []
}
