{
  "schema": "eravos.tool/1",
  "id": "eravos.bass-drop-builder",
  "version": "3.0.0",
  "label": "Drop Builder",
  "icon": "🔻",
  "accent": "#ff2266",
  "domain": "music",
  "category": "arrange",
  "summary": "Build the moment: tension → build → silence → DROP, with her voice landing right before the bass hits.",
  "tags": [
    "arrange",
    "bass",
    "drop",
    "builder"
  ],
  "files": {
    "engine": "bass-drop-builder.engine.js",
    "ui": "bass-drop-builder.ui.js",
    "spec": "bass-drop-builder.spec",
    "preview": "preview.png",
    "tests": "bass-drop-builder.test.js"
  },
  "needs": {
    "units": [
      "music.engine"
    ],
    "tools": [],
    "permissions": [
      "audio_out",
      "bus_publish",
      "bus_subscribe",
      "filesystem_read",
      "registry_read"
    ]
  },
  "packs": {
    "accepts": [
      "presets"
    ],
    "shipped": [
      "factory"
    ]
  },
  "works_with": [
    "eravos.channel",
    "eravos.clip-maker",
    "eravos.contrast-analyser",
    "eravos.dub-station",
    "eravos.fx-destroyer",
    "eravos.fx-dynamics",
    "eravos.fx-echo",
    "eravos.fx-eq",
    "eravos.fx-filter",
    "eravos.fx-glitch",
    "eravos.fx-haunt",
    "eravos.fx-moddelay",
    "eravos.fx-phaser",
    "eravos.fx-pitch",
    "eravos.harmonic-analyzer",
    "eravos.master-fx",
    "eravos.sidechain-compressor",
    "eravos.wub-filter"
  ],
  "status": "built",
  "conflicts": []
}
