{
  "schema": "eravos.tool/1",
  "id": "eravos.organ",
  "version": "1.1.0",
  "label": "Gothic Organ",
  "icon": "⛪",
  "accent": "#8a2be2",
  "domain": "music",
  "category": "genre-instruments",
  "summary": "Dark organ: 9 drawbars, pipe tones, percussion, tube amp, spinning rotary speaker, beat-locked pulse, gothic chords, cathedral space.",
  "tags": [
    "genre-instruments",
    "organ"
  ],
  "files": {
    "engine": "organ.engine.js",
    "ui": "organ.ui.js",
    "spec": "organ.spec",
    "preview": "preview.png",
    "tests": "organ.test.js"
  },
  "needs": {
    "units": [
      "music.engine"
    ],
    "tools": [],
    "permissions": [
      "audio_out",
      "midi_in",
      "bus_publish",
      "bus_subscribe"
    ]
  },
  "packs": {
    "accepts": [
      "presets"
    ],
    "shipped": [
      "factory"
    ]
  },
  "works_with": [
    "eravos.breath",
    "eravos.channel",
    "eravos.clip-maker",
    "eravos.contrast-analyser",
    "eravos.dub-station",
    "eravos.embodiment-lab",
    "eravos.fx-destroyer",
    "eravos.fx-dynamics",
    "eravos.fx-echo",
    "eravos.fx-eq",
    "eravos.fx-filter",
    "eravos.fx-glitch",
    "eravos.fx-haunt",
    "eravos.fx-moddelay",
    "eravos.fx-phaser",
    "eravos.fx-pitch",
    "eravos.granular",
    "eravos.harmonic-analyzer",
    "eravos.lfo",
    "eravos.macro-automation",
    "eravos.master-fx",
    "eravos.sidechain-compressor",
    "eravos.syn-env",
    "eravos.syn-osc",
    "eravos.wobble-bass",
    "eravos.wub-filter",
    "eravos.wub-osc",
    "eravos.wub-rate",
    "eravos.wub-sub",
    "eravos.xy-pad"
  ],
  "status": "built",
  "conflicts": []
}
