{
  "schema": "eravos.tool/1",
  "id": "eravos.reese-bass",
  "version": "2.0.0",
  "label": "Reese Bass",
  "icon": "🔈",
  "accent": "#ff2266",
  "domain": "music",
  "category": "sound-sources",
  "summary": "Huge rolling drum & bass / neuro bass — detuned saws that breathe and flange.",
  "tags": [
    "sound-sources",
    "reese",
    "bass"
  ],
  "files": {
    "engine": "reese-bass.engine.js",
    "ui": "reese-bass.ui.js",
    "spec": "reese-bass.spec",
    "preview": "preview.png",
    "tests": "reese-bass.test.js"
  },
  "needs": {
    "units": [
      "music.engine"
    ],
    "tools": [],
    "permissions": [
      "audio_out",
      "midi_in",
      "bus_publish",
      "bus_subscribe"
    ]
  },
  "packs": {
    "accepts": [
      "presets"
    ],
    "shipped": [
      "factory"
    ]
  },
  "works_with": [
    "eravos.breath",
    "eravos.channel",
    "eravos.clip-maker",
    "eravos.contrast-analyser",
    "eravos.dub-station",
    "eravos.embodiment-lab",
    "eravos.fx-destroyer",
    "eravos.fx-dynamics",
    "eravos.fx-echo",
    "eravos.fx-eq",
    "eravos.fx-filter",
    "eravos.fx-glitch",
    "eravos.fx-haunt",
    "eravos.fx-moddelay",
    "eravos.fx-phaser",
    "eravos.fx-pitch",
    "eravos.granular",
    "eravos.harmonic-analyzer",
    "eravos.lfo",
    "eravos.macro-automation",
    "eravos.master-fx",
    "eravos.sidechain-compressor",
    "eravos.syn-env",
    "eravos.syn-osc",
    "eravos.wobble-bass",
    "eravos.wub-filter",
    "eravos.wub-osc",
    "eravos.wub-rate",
    "eravos.wub-sub",
    "eravos.xy-pad"
  ],
  "status": "built",
  "conflicts": []
}
