{
  "schema": "eravos.tool/1",
  "id": "eravos.suite",
  "version": "1.0.0",
  "label": "Suite",
  "icon": "🧰",
  "accent": "#ff2266",
  "domain": "music",
  "category": "suites",
  "summary": "A suite's own window: the system its parts connect to. Build it whole, add parts one by one, load a scene, mix in parts from other suites.",
  "tags": [
    "suites",
    "system",
    "wubs"
  ],
  "files": {
    "engine": "suite.engine.js",
    "ui": "suite.ui.js",
    "spec": "suite.spec",
    "tests": "suite.test.js",
    "css": "suite.css",
    "preview": "preview.png"
  },
  "needs": {
    "units": [
      "music.engine"
    ],
    "tools": [],
    "permissions": [
      "audio_in",
      "audio_out",
      "bus_publish",
      "bus_subscribe",
      "registry_read"
    ]
  },
  "packs": {
    "accepts": [],
    "shipped": []
  },
  "works_with": [
    "eravos.acid-synth",
    "eravos.bass-drop-builder",
    "eravos.bass-forge",
    "eravos.breath",
    "eravos.channel",
    "eravos.clip-maker",
    "eravos.contrast-analyser",
    "eravos.coven",
    "eravos.curve-synth",
    "eravos.drum-forge",
    "eravos.dub-station",
    "eravos.edm-lab",
    "eravos.embodiment-lab",
    "eravos.fx-box",
    "eravos.fx-destroyer",
    "eravos.fx-dynamics",
    "eravos.fx-echo",
    "eravos.fx-eq",
    "eravos.fx-filter",
    "eravos.fx-glitch",
    "eravos.fx-haunt",
    "eravos.fx-moddelay",
    "eravos.fx-phaser",
    "eravos.fx-pitch",
    "eravos.granular",
    "eravos.harmonic-analyzer",
    "eravos.lfo",
    "eravos.macro-automation",
    "eravos.master-fx",
    "eravos.organ",
    "eravos.pad-forge",
    "eravos.pads",
    "eravos.ratio-lattice",
    "eravos.recursive-spectra",
    "eravos.reese-bass",
    "eravos.retro-poly",
    "eravos.sample-player",
    "eravos.sidechain-compressor",
    "eravos.song-recorder",
    "eravos.sub-engine",
    "eravos.supersaw",
    "eravos.syn-env",
    "eravos.syn-osc",
    "eravos.syn-partials",
    "eravos.timeline",
    "eravos.wobble-bass",
    "eravos.wub-filter",
    "eravos.wub-osc",
    "eravos.wub-rate",
    "eravos.wub-sub",
    "eravos.xen-synth",
    "eravos.xy-pad"
  ],
  "conflicts": [],
  "status": "built"
}
