{
  "schema": "eravos.tool/1",
  "id": "eravos.sample-player",
  "version": "2.0.0",
  "label": "Sample",
  "icon": "🎵",
  "accent": "#aa44ff",
  "domain": "music",
  "category": "voice-and-samples",
  "summary": "Load her voice clip: play it, pitch it, loop it or chop it into slices.",
  "tags": [
    "voice-and-samples",
    "sample",
    "player"
  ],
  "files": {
    "engine": "sample-player.engine.js",
    "ui": "sample-player.ui.js",
    "spec": "sample-player.spec",
    "preview": "preview.png",
    "tests": "sample-player.test.js"
  },
  "needs": {
    "units": [
      "music.engine"
    ],
    "tools": [],
    "permissions": [
      "audio_out",
      "bus_publish",
      "bus_subscribe",
      "filesystem_read"
    ]
  },
  "packs": {
    "accepts": [
      "presets"
    ],
    "shipped": [
      "factory"
    ]
  },
  "works_with": [
    "eravos.breath",
    "eravos.channel",
    "eravos.clip-maker",
    "eravos.contrast-analyser",
    "eravos.dub-station",
    "eravos.embodiment-lab",
    "eravos.fx-destroyer",
    "eravos.fx-dynamics",
    "eravos.fx-echo",
    "eravos.fx-eq",
    "eravos.fx-filter",
    "eravos.fx-glitch",
    "eravos.fx-haunt",
    "eravos.fx-moddelay",
    "eravos.fx-phaser",
    "eravos.fx-pitch",
    "eravos.harmonic-analyzer",
    "eravos.lfo",
    "eravos.macro-automation",
    "eravos.master-fx",
    "eravos.sidechain-compressor",
    "eravos.syn-env",
    "eravos.syn-osc",
    "eravos.wub-filter",
    "eravos.wub-osc",
    "eravos.wub-rate",
    "eravos.wub-sub",
    "eravos.xy-pad"
  ],
  "status": "built",
  "conflicts": []
}
